{
  "counts": {
    "exact_current": 350,
    "replacement": 15,
    "routes": 368,
    "valid_weaker": 3
  },
  "map_id": "LEGACY-COMPAT-ee2d439951a1",
  "routes": [
    {
      "disposition": "exact_current",
      "legacy_unit_id": "JCG-0106262F",
      "route": "claims/JCG-0106262F/",
      "targets": [
        {
          "role": "current_statement",
          "statement_version": 1,
          "unit_id": "JCG-0106262F"
        }
      ]
    },
    {
      "disposition": "exact_current",
      "legacy_unit_id": "JCG-015F97FF",
      "route": "claims/JCG-015F97FF/",
      "targets": [
        {
          "role": "current_statement",
          "statement_version": 1,
          "unit_id": "JCG-015F97FF"
        }
      ]
    },
    {
      "disposition": "exact_current",
      "legacy_unit_id": "JCG-02C45EB8",
      "route": "claims/JCG-02C45EB8/",
      "targets": [
        {
          "role": "current_statement",
          "statement_version": 1,
          "unit_id": "JCG-02C45EB8"
        }
      ]
    },
    {
      "disposition": "exact_current",
      "legacy_unit_id": "JCG-033B78BD",
      "route": "claims/JCG-033B78BD/",
      "targets": [
        {
          "role": "current_statement",
          "statement_version": 1,
          "unit_id": "JCG-033B78BD"
        }
      ]
    },
    {
      "disposition": "exact_current",
      "legacy_unit_id": "JCG-0378B011",
      "route": "claims/JCG-0378B011/",
      "targets": [
        {
          "role": "current_statement",
          "statement_version": 1,
          "unit_id": "JCG-0378B011"
        }
      ]
    },
    {
      "disposition": "exact_current",
      "legacy_unit_id": "JCG-037F2BD5",
      "route": "claims/JCG-037F2BD5/",
      "targets": [
        {
          "role": "current_statement",
          "statement_version": 1,
          "unit_id": "JCG-037F2BD5"
        }
      ]
    },
    {
      "disposition": "exact_current",
      "legacy_unit_id": "JCG-046E56A8",
      "route": "claims/JCG-046E56A8/",
      "targets": [
        {
          "role": "current_statement",
          "statement_version": 1,
          "unit_id": "JCG-046E56A8"
        }
      ]
    },
    {
      "disposition": "exact_current",
      "legacy_unit_id": "JCG-049C83F7",
      "route": "claims/JCG-049C83F7/",
      "targets": [
        {
          "role": "current_statement",
          "statement_version": 1,
          "unit_id": "JCG-049C83F7"
        }
      ]
    },
    {
      "disposition": "exact_current",
      "legacy_unit_id": "JCG-059D835C",
      "route": "claims/JCG-059D835C/",
      "targets": [
        {
          "role": "current_statement",
          "statement_version": 1,
          "unit_id": "JCG-059D835C"
        }
      ]
    },
    {
      "disposition": "exact_current",
      "legacy_unit_id": "JCG-0632B2B1",
      "route": "claims/JCG-0632B2B1/",
      "targets": [
        {
          "role": "current_statement",
          "statement_version": 1,
          "unit_id": "JCG-0632B2B1"
        }
      ]
    },
    {
      "disposition": "exact_current",
      "legacy_unit_id": "JCG-068E58B0",
      "route": "claims/JCG-068E58B0/",
      "targets": [
        {
          "role": "current_statement",
          "statement_version": 1,
          "unit_id": "JCG-068E58B0"
        }
      ]
    },
    {
      "disposition": "exact_current",
      "legacy_unit_id": "JCG-06EFD647",
      "route": "claims/JCG-06EFD647/",
      "targets": [
        {
          "role": "current_statement",
          "statement_version": 1,
          "unit_id": "JCG-06EFD647"
        }
      ]
    },
    {
      "disposition": "exact_current",
      "legacy_unit_id": "JCG-075712B5",
      "route": "claims/JCG-075712B5/",
      "targets": [
        {
          "role": "current_statement",
          "statement_version": 1,
          "unit_id": "JCG-075712B5"
        }
      ]
    },
    {
      "disposition": "exact_current",
      "legacy_unit_id": "JCG-0759F9E6",
      "route": "claims/JCG-0759F9E6/",
      "targets": [
        {
          "role": "current_statement",
          "statement_version": 1,
          "unit_id": "JCG-0759F9E6"
        }
      ]
    },
    {
      "disposition": "exact_current",
      "legacy_unit_id": "JCG-08AE5516",
      "route": "claims/JCG-08AE5516/",
      "targets": [
        {
          "role": "current_statement",
          "statement_version": 1,
          "unit_id": "JCG-08AE5516"
        }
      ]
    },
    {
      "disposition": "exact_current",
      "legacy_unit_id": "JCG-0934E7C3",
      "route": "claims/JCG-0934E7C3/",
      "targets": [
        {
          "role": "current_statement",
          "statement_version": 1,
          "unit_id": "JCG-0934E7C3"
        }
      ]
    },
    {
      "disposition": "exact_current",
      "legacy_unit_id": "JCG-099F60DA",
      "route": "claims/JCG-099F60DA/",
      "targets": [
        {
          "role": "current_statement",
          "statement_version": 1,
          "unit_id": "JCG-099F60DA"
        }
      ]
    },
    {
      "disposition": "exact_current",
      "legacy_unit_id": "JCG-0A4149FE",
      "route": "claims/JCG-0A4149FE/",
      "targets": [
        {
          "role": "current_statement",
          "statement_version": 1,
          "unit_id": "JCG-0A4149FE"
        }
      ]
    },
    {
      "disposition": "exact_current",
      "legacy_unit_id": "JCG-0A41960D",
      "route": "claims/JCG-0A41960D/",
      "targets": [
        {
          "role": "current_statement",
          "statement_version": 1,
          "unit_id": "JCG-0A41960D"
        }
      ]
    },
    {
      "disposition": "exact_current",
      "legacy_unit_id": "JCG-0A4D8C5B",
      "route": "claims/JCG-0A4D8C5B/",
      "targets": [
        {
          "role": "current_statement",
          "statement_version": 1,
          "unit_id": "JCG-0A4D8C5B"
        }
      ]
    },
    {
      "disposition": "exact_current",
      "legacy_unit_id": "JCG-0B37D36F",
      "route": "claims/JCG-0B37D36F/",
      "targets": [
        {
          "role": "current_statement",
          "statement_version": 1,
          "unit_id": "JCG-0B37D36F"
        }
      ]
    },
    {
      "disposition": "exact_current",
      "legacy_unit_id": "JCG-0B4E8503",
      "route": "claims/JCG-0B4E8503/",
      "targets": [
        {
          "role": "current_statement",
          "statement_version": 1,
          "unit_id": "JCG-0B4E8503"
        }
      ]
    },
    {
      "disposition": "exact_current",
      "legacy_unit_id": "JCG-0C43F49B",
      "route": "claims/JCG-0C43F49B/",
      "targets": [
        {
          "role": "current_statement",
          "statement_version": 1,
          "unit_id": "JCG-0C43F49B"
        }
      ]
    },
    {
      "disposition": "exact_current",
      "legacy_unit_id": "JCG-0C788598",
      "route": "claims/JCG-0C788598/",
      "targets": [
        {
          "role": "current_statement",
          "statement_version": 1,
          "unit_id": "JCG-0C788598"
        }
      ]
    },
    {
      "disposition": "exact_current",
      "legacy_unit_id": "JCG-0EDD5AE2",
      "route": "claims/JCG-0EDD5AE2/",
      "targets": [
        {
          "role": "current_statement",
          "statement_version": 1,
          "unit_id": "JCG-0EDD5AE2"
        }
      ]
    },
    {
      "disposition": "exact_current",
      "legacy_unit_id": "JCG-0F9A20C0",
      "route": "claims/JCG-0F9A20C0/",
      "targets": [
        {
          "role": "current_statement",
          "statement_version": 1,
          "unit_id": "JCG-0F9A20C0"
        }
      ]
    },
    {
      "disposition": "exact_current",
      "legacy_unit_id": "JCG-1035DE2E",
      "route": "claims/JCG-1035DE2E/",
      "targets": [
        {
          "role": "current_statement",
          "statement_version": 1,
          "unit_id": "JCG-1035DE2E"
        }
      ]
    },
    {
      "disposition": "exact_current",
      "legacy_unit_id": "JCG-10B255A3",
      "route": "claims/JCG-10B255A3/",
      "targets": [
        {
          "role": "current_statement",
          "statement_version": 1,
          "unit_id": "JCG-10B255A3"
        }
      ]
    },
    {
      "disposition": "exact_current",
      "legacy_unit_id": "JCG-10BD21D3",
      "route": "claims/JCG-10BD21D3/",
      "targets": [
        {
          "role": "current_statement",
          "statement_version": 1,
          "unit_id": "JCG-10BD21D3"
        }
      ]
    },
    {
      "disposition": "exact_current",
      "legacy_unit_id": "JCG-1183609D",
      "route": "claims/JCG-1183609D/",
      "targets": [
        {
          "role": "current_statement",
          "statement_version": 1,
          "unit_id": "JCG-1183609D"
        }
      ]
    },
    {
      "disposition": "exact_current",
      "legacy_unit_id": "JCG-11AA7A99",
      "route": "claims/JCG-11AA7A99/",
      "targets": [
        {
          "role": "current_statement",
          "statement_version": 1,
          "unit_id": "JCG-11AA7A99"
        }
      ]
    },
    {
      "disposition": "exact_current",
      "legacy_unit_id": "JCG-121331E0",
      "route": "claims/JCG-121331E0/",
      "targets": [
        {
          "role": "current_statement",
          "statement_version": 1,
          "unit_id": "JCG-121331E0"
        }
      ]
    },
    {
      "disposition": "exact_current",
      "legacy_unit_id": "JCG-122FC9F6",
      "route": "claims/JCG-122FC9F6/",
      "targets": [
        {
          "role": "current_statement",
          "statement_version": 1,
          "unit_id": "JCG-122FC9F6"
        }
      ]
    },
    {
      "disposition": "exact_current",
      "legacy_unit_id": "JCG-1295A385",
      "route": "claims/JCG-1295A385/",
      "targets": [
        {
          "role": "current_statement",
          "statement_version": 1,
          "unit_id": "JCG-1295A385"
        }
      ]
    },
    {
      "disposition": "exact_current",
      "legacy_unit_id": "JCG-12CFF8C9",